{
  "schema_version": "1.0",
  "eiis_version": "3.0.0",
  "package": {
    "name": "gilgamesh",
    "version": "1.1.0",
    "manifest_sha256": "1959aa7e696de69cca02c37845007451a8054fa541b9d1578efadff89efb2317"
  },
  "installed_at": "2026-09-29T20:59:48Z",
  "target": "./.eidolons/gilgamesh",
  "tree_sha256": "c12e3a7ce3d55ab7c5c87e77ad7849ac55311593eb67b04c1354d1dbacbe6f8d",
  "adapters": [
    {
      "host": "claude-code",
      "path": ".claude/agents/gilgamesh.md",
      "type": "pointer",
      "canonical": ".eidolons/gilgamesh/PERSONA.md"
    },
    {
      "host": "claude-code",
      "path": ".claude/skills/gilgamesh-attest/SKILL.md",
      "type": "symlink",
      "canonical": ".eidolons/gilgamesh/skills/attest/SKILL.md"
    },
    {
      "host": "claude-code",
      "path": ".claude/skills/gilgamesh-esl-hop/SKILL.md",
      "type": "symlink",
      "canonical": ".eidolons/gilgamesh/skills/esl-hop/SKILL.md"
    },
    {
      "host": "claude-code",
      "path": ".claude/skills/gilgamesh-gauge/SKILL.md",
      "type": "symlink",
      "canonical": ".eidolons/gilgamesh/skills/gauge/SKILL.md"
    },
    {
      "host": "claude-code",
      "path": ".claude/skills/gilgamesh-grind/SKILL.md",
      "type": "symlink",
      "canonical": ".eidolons/gilgamesh/skills/grind/SKILL.md"
    },
    {
      "host": "claude-code",
      "path": ".claude/skills/gilgamesh-verify-incoming/SKILL.md",
      "type": "symlink",
      "canonical": ".eidolons/gilgamesh/skills/verify-incoming/SKILL.md"
    },
    {
      "host": "codex",
      "path": ".codex/agents/gilgamesh.toml",
      "type": "pointer",
      "canonical": ".eidolons/gilgamesh/PERSONA.md"
    },
    {
      "host": "cursor",
      "path": ".cursor/rules/gilgamesh.mdc",
      "type": "pointer",
      "canonical": ".eidolons/gilgamesh/PERSONA.md"
    },
    {
      "host": "cursor",
      "path": ".cursor/agents/gilgamesh.md",
      "type": "pointer",
      "canonical": ".eidolons/gilgamesh/PERSONA.md"
    },
    {
      "host": "cursor",
      "path": ".cursor/skills/gilgamesh-attest/SKILL.md",
      "type": "symlink",
      "canonical": ".eidolons/gilgamesh/skills/attest/SKILL.md"
    },
    {
      "host": "cursor",
      "path": ".cursor/skills/gilgamesh-esl-hop/SKILL.md",
      "type": "symlink",
      "canonical": ".eidolons/gilgamesh/skills/esl-hop/SKILL.md"
    },
    {
      "host": "cursor",
      "path": ".cursor/skills/gilgamesh-gauge/SKILL.md",
      "type": "symlink",
      "canonical": ".eidolons/gilgamesh/skills/gauge/SKILL.md"
    },
    {
      "host": "cursor",
      "path": ".cursor/skills/gilgamesh-grind/SKILL.md",
      "type": "symlink",
      "canonical": ".eidolons/gilgamesh/skills/grind/SKILL.md"
    },
    {
      "host": "cursor",
      "path": ".cursor/skills/gilgamesh-verify-incoming/SKILL.md",
      "type": "symlink",
      "canonical": ".eidolons/gilgamesh/skills/verify-incoming/SKILL.md"
    }
  ]
}
