{
  "schema_version": "1.0",
  "eiis_version": "3.0.0",
  "package": {
    "name": "kupo",
    "version": "1.4.0",
    "manifest_sha256": "17753877ebafb58207a99a380b38c8f3b3a54fe2fb69a59130521354a185eb45"
  },
  "installed_at": "2026-09-29T20:59:47Z",
  "target": "./.eidolons/kupo",
  "tree_sha256": "35d22624a4c4de7d085c413da34953e4f54fde440074e6cf6b96bbf51116a62c",
  "adapters": [
    {
      "host": "claude-code",
      "path": ".claude/agents/kupo.md",
      "type": "pointer",
      "canonical": ".eidolons/kupo/PERSONA.md"
    },
    {
      "host": "claude-code",
      "path": ".claude/skills/kupo-esl-hop/SKILL.md",
      "type": "symlink",
      "canonical": ".eidolons/kupo/skills/esl-hop/SKILL.md"
    },
    {
      "host": "claude-code",
      "path": ".claude/skills/kupo-keep-or-kick/SKILL.md",
      "type": "symlink",
      "canonical": ".eidolons/kupo/skills/keep-or-kick/SKILL.md"
    },
    {
      "host": "claude-code",
      "path": ".claude/skills/kupo-patch-verify/SKILL.md",
      "type": "symlink",
      "canonical": ".eidolons/kupo/skills/patch-verify/SKILL.md"
    },
    {
      "host": "claude-code",
      "path": ".claude/skills/kupo-verify-incoming/SKILL.md",
      "type": "symlink",
      "canonical": ".eidolons/kupo/skills/verify-incoming/SKILL.md"
    },
    {
      "host": "codex",
      "path": ".codex/agents/kupo.toml",
      "type": "pointer",
      "canonical": ".eidolons/kupo/PERSONA.md"
    },
    {
      "host": "cursor",
      "path": ".cursor/rules/kupo.mdc",
      "type": "pointer",
      "canonical": ".eidolons/kupo/PERSONA.md"
    },
    {
      "host": "cursor",
      "path": ".cursor/agents/kupo.md",
      "type": "pointer",
      "canonical": ".eidolons/kupo/PERSONA.md"
    },
    {
      "host": "cursor",
      "path": ".cursor/skills/kupo-esl-hop/SKILL.md",
      "type": "symlink",
      "canonical": ".eidolons/kupo/skills/esl-hop/SKILL.md"
    },
    {
      "host": "cursor",
      "path": ".cursor/skills/kupo-keep-or-kick/SKILL.md",
      "type": "symlink",
      "canonical": ".eidolons/kupo/skills/keep-or-kick/SKILL.md"
    },
    {
      "host": "cursor",
      "path": ".cursor/skills/kupo-patch-verify/SKILL.md",
      "type": "symlink",
      "canonical": ".eidolons/kupo/skills/patch-verify/SKILL.md"
    },
    {
      "host": "cursor",
      "path": ".cursor/skills/kupo-verify-incoming/SKILL.md",
      "type": "symlink",
      "canonical": ".eidolons/kupo/skills/verify-incoming/SKILL.md"
    }
  ]
}
